{
  "$schema": "https://json-schema.org/draft/2020-12/schema",
  "$id": "https://github.com/jimisola/AutoLee/schemas/state.schema.json",
  "title": "AutoLee device state",
  "description": "Payload of GET /api/state and of the default (state) SSE event on /events.",
  "type": "object",
  "additionalProperties": false,
  "required": [
    "version", "state", "defaultPassword", "counter", "speed", "calibrated", "positionStale",
    "rawUp", "rawDown", "endpointUp", "endpointDown",
    "upOffset", "downOffset", "position", "sgTrip", "workZone", "currentMa",
    "profileIdx", "profileName", "profiles",
    "wifiStatus", "wifiSSID", "wifiIP", "wifiHostname",
    "batchTarget", "batchCount", "batchActive",
    "sgSetUp", "sgCalCurrentMa", "autoSgActive", "autoSgProfile", "autoSgStroke", "autoSgStrokes"
  ],
  "properties": {
    "version": { "type": "string" },
    "state": {
      "type": "string",
      "enum": ["IDLE", "RUNNING", "STOPPING", "CALIBRATING", "STALLED", "HOMING"]
    },
    "counter": { "type": "integer", "minimum": 0, "maximum": 9999 },
    "speed": { "type": "integer", "minimum": 0 },
    "calibrated": { "type": "boolean" },
    "defaultPassword": {
      "type": "boolean",
      "description": "True while the web/API password is still the factory default (\"autolee\"). While true, the firmware refuses every state-changing write except POST /api/v1/system/web_password with 403 - set a real password to clear this."
    },
    "positionStale": {
      "type": "boolean",
      "description": "Calibration was restored across a reboot but the axis has not been re-referenced against the UP hard stop since. The device refuses to start a run while this is true; a Return Home (or a fresh calibration) clears it."
    },
    "rawUp": { "type": "integer" },
    "rawDown": { "type": "integer" },
    "endpointUp": { "type": "integer" },
    "endpointDown": { "type": "integer" },
    "upOffset": { "type": "integer" },
    "downOffset": { "type": "integer" },
    "position": { "type": "integer" },
    "sgTrip": { "type": "integer", "minimum": 0, "maximum": 1023 },
    "workZone": { "type": "integer" },
    "currentMa": { "type": "integer", "minimum": 0 },
    "profileIdx": { "type": "integer", "minimum": 0, "maximum": 2 },
    "profileName": { "type": "string" },
    "profiles": {
      "type": "array",
      "minItems": 3,
      "maxItems": 3,
      "items": {
        "type": "object",
        "additionalProperties": false,
        "required": ["name", "hz", "sg", "floor"],
        "properties": {
          "name": { "type": "string" },
          "hz": { "type": "integer", "minimum": 0 },
          "sg": {
            "type": "integer",
            "minimum": 0,
            "maximum": 1023,
            "description": "StallGuard trip; a jam is SG_RESULT above it. 0 means not set, and the press refuses to run until every profile has one (see sgSetUp)."
          },
          "floor": {
            "type": "boolean",
            "description": "The trip sits at the SG floor (Auto SG read only 0/1 at this speed). Detection then relies on a stall spiking off the floor and is limited; block-test the profile."
          }
        }
      }
    },
    "wifiStatus": { "type": "string" },
    "wifiSSID": { "type": "string" },
    "wifiIP": { "type": "string" },
    "wifiHostname": {
      "type": "string",
      "description": "mDNS name the device advertises, e.g. \"autolee.local\". Empty string when it advertises none - on the setup AP, or if mDNS failed to start. Always present, never null. A convenience on top of wifiIP and never a replacement: mDNS does not resolve everywhere, so wifiIP stays the address of record."
    },
    "batchTarget": { "type": "integer", "minimum": 0 },
    "batchCount": { "type": "integer", "minimum": 0 },
    "batchActive": { "type": "boolean" },
    "sgSetUp": {
      "type": "boolean",
      "description": "Every profile has a StallGuard trip. While false the device refuses to start a run (409 jam_detection_not_set_up); POST /api/v1/motion/auto_sg sets them."
    },
    "sgCalCurrentMa": {
      "type": "integer",
      "minimum": 0,
      "description": "Run current Auto SG last measured at, in mA. 0 if it never ran. Trips hold only at this current."
    },
    "autoSgActive": { "type": "boolean", "description": "Auto SG is measuring; jam detection is off for this run." },
    "autoSgProfile": { "type": "integer", "minimum": 0, "maximum": 2, "description": "Profile being measured while autoSgActive." },
    "autoSgStroke": { "type": "integer", "minimum": 0, "description": "Measured strokes so far on that profile." },
    "autoSgStrokes": { "type": "integer", "minimum": 0, "description": "Strokes Auto SG measures per profile." }
  }
}
