{"version":"1.8","state":"IDLE","defaultPassword":false,"counter":42,"speed":30000,"calibrated":true,"positionStale":false,"rawUp":0,"rawDown":10000,"endpointUp":0,"endpointDown":9500,"upOffset":0,"downOffset":-500,"position":0,"sgTrip":15,"workZone":5500,"currentMa":3500,"profileIdx":1,"profileName":"Normal","profiles":[{"name":"Slow","hz":15000,"sg":41,"floor":false},{"name":"Normal","hz":30000,"sg":15,"floor":false},{"name":"Fast","hz":40000,"sg":2,"floor":true}],"wifiStatus":"Connected","wifiSSID":"MyNet","wifiIP":"192.168.1.50","wifiHostname":"autolee.local","batchTarget":100,"batchCount":7,"batchActive":true,"sgSetUp":true,"sgCalCurrentMa":3500,"autoSgActive":false,"autoSgProfile":0,"autoSgStroke":0,"autoSgStrokes":12}
